{"bindings":{"cluster-1":{"asset_key":"94be0983e03838a1c62c528a3f22621a7dc307f0349545731de2737ac264c64a","material_policy":{"mode":"override","profile_id":null,"profile_sha256":null},"representation":"godot_static_source_v1","update_policy":"prompt"}},"dependencies":{"3e4cecabdb6c9bac29d5f9c655852e10f1d96abdb437cee386bfecf3974b1cbf":{"asset_ref":{"asset_id":"ast_00000000000000aa","library_id":"prj_0000000000000001","server_id":"6f1c2a52-3c2e-4d4b-9a57-0b6f6f0c1d2e","version_id":"ver_00000000000000v1"},"deliveries":{"portable_glb_v1":{"delivery_id":"dlv_00000000000000d1","manifest_sha256":"3af631546729db64d1b19e56406e7c5f1787f2801e1fa953c86e467714c4f011","profile_id":"portable-default","profile_version":"1.0.0"}},"descriptor_sha256":"5b8517a39e3892184c5df6b733884265adae4289345cca8bd6172ffab15fb49b","requires":[]},"94be0983e03838a1c62c528a3f22621a7dc307f0349545731de2737ac264c64a":{"asset_ref":{"asset_id":"ast_00000000000000af","library_id":"prj_0000000000000001","server_id":"6f1c2a52-3c2e-4d4b-9a57-0b6f6f0c1d2e","version_id":"ver_00000000000000v1"},"deliveries":{"godot_static_source_v1":{"delivery_id":"dlv_00000000000000d4","manifest_sha256":"409ffbab1456db2fd1ace71d5123036ebbec0e444a9d86e98532bcba86c8bb7d","profile_id":"godot-static-source","profile_version":"1.0.0"}},"descriptor_sha256":"1a588f1ae32858b0cd1cd3a5cdf2b7f041f89ef081d5785298191dba79a6332a","requires":["3e4cecabdb6c9bac29d5f9c655852e10f1d96abdb437cee386bfecf3974b1cbf"]}},"generator":{"addon_version":"1.0.0","installer_version":"1.0.0"},"roots":[{"asset_keys":["94be0983e03838a1c62c528a3f22621a7dc307f0349545731de2737ac264c64a","3e4cecabdb6c9bac29d5f9c655852e10f1d96abdb437cee386bfecf3974b1cbf"],"owner_id":"cluster-1","owner_kind":"scene_binding"}],"schema_version":1}